13:03:53.859242 IP ip-192-168-72-36.ap-south-1.compute.internal.http-alt > ec2-52-66-221-224.ap-south-1.compute.amazonaws.com.51944: Flags [P.], seq 1647062209:1647062414, ack 1342565759, win 2179, options [nop,nop,TS val 2753542761 ecr 254248178], length 205: HTTP
13:03:53.859519 IP ec2-52-66-221-224.ap-south-1.compute.amazonaws.com.51944 > ip-192-168-72-36.ap-south-1.compute.internal.http-alt: Flags [.], ack 205, win 6703, options [nop,nop,TS val 254248220 ecr 2753542761], length 0
13:03:53.897449 IP ec2-52-66-221-224.ap-south-1.compute.amazonaws.com.51944 > ip-192-168-72-36.ap-south-1.compute.internal.http-alt: Flags [P.], seq 1:103, ack 205, win 6703, options [nop,nop,TS val 254248258 ecr 2753542761], length 102: HTTP
13:03:53.897749 IP ip-192-168-72-36.ap-south-1.compute.internal.http-alt > ec2-52-66-221-224.ap-south-1.compute.amazonaws.com.51944: Flags [P.], seq 205:243, ack 103, win 2179, options [nop,nop,TS val 2753542799 ecr 254248258], length 38: HTTP
13:03:53.912177 IP ec2-13-233-98-105.ap-south-1.compute.amazonaws.com.31682 > ip-192-168-72-36.ap-south-1.compute.internal.http-alt: Flags [P.], seq 2301592255:2301596351, ack 402821728, win 6283, options [nop,nop,TS val 4073909435 ecr 4199668837], length 4096: HTTP
13:03:53.912213 IP ip-192-168-72-36.ap-south-1.compute.internal.http-alt > ec2-13-233-98-105.ap-south-1.compute.amazonaws.com.31682: Flags [.], ack 4096, win 442, options [nop,nop,TS val 4199669080 ecr 4073909435], length 0
13:03:53.912220 IP ec2-13-233-98-105.ap-south-1.compute.amazonaws.com.31682 > ip-192-168-72-36.ap-south-1.compute.internal.http-alt: Flags [P.], seq 4096:8192, ack 1, win 6283, options [nop,nop,TS val 4073909435 ecr 4199668837], length 4096: HTTP
13:03:53.912228 IP ec2-13-233-98-105.ap-south-1.compute.amazonaws.com.31682 > ip-192-168-72-36.ap-south-1.compute.internal.http-alt: Flags [P.], seq 8192:12288, ack 1, win 6283, options [nop,nop,TS val 4073909435 ecr 4199668837], length 4096: HTTP
13:03:53.912238 IP ec2-13-233-98-105.ap-south-1.compute.amazonaws.com.31682 > ip-192-168-72-36.ap-south-1.compute.internal.http-alt: Flags [.], seq 12288:13736, ack 1, win 6283, options [nop,nop,TS val 4073909435 ecr 4199668837], length 1448: HTTP
13:03:53.912270 IP ip-192-168-72-36.ap-south-1.compute.internal.http-alt > ec2-13-233-98-105.ap-south-1.compute.amazonaws.com.31682: Flags [.], ack 13736, win 442, options [nop,nop,TS val 4199669080 ecr 4073909435], length 0
13:03:53.912736 IP ec2-13-233-98-105.ap-south-1.compute.amazonaws.com.31682 > ip-192-168-72-36.ap-south-1.compute.internal.http-alt: Flags [P.], seq 13736:16384, ack 1, win 6283, options [nop,nop,TS val 4073909435 ecr 4199669080], length 2648: HTTP
13:03:53.912741 IP ip-192-168-72-36.ap-south-1.compute.internal.http-alt > ec2-13-233-98-105.ap-south-1.compute.amazonaws.com.31682: Flags [.], ack 16384, win 442, options [nop,nop,TS val 4199669080 ecr 4073909435], length 0
13:03:53.940227 IP ec2-52-66-221-224.ap-south-1.compute.amazonaws.com.51944 > ip-192-168-72-36.ap-south-1.compute.internal.http-alt: Flags [.], ack 243, win 6703, options [nop,nop,TS val 254248301 ecr 2753542799], length 0
13:03:54.117007 IP ec2-52-66-221-224.ap-south-1.compute.amazonaws.com.51944 > ip-192-168-72-36.ap-south-1.compute.internal.http-alt: Flags [P.], seq 103:145, ack 243, win 6703, options [nop,nop,TS val 254248477 ecr 2753542799], length 42: HTTP
13:03:54.160379 IP ip-192-168-72-36.ap-south-1.compute.internal.http-alt > ec2-52-66-221-224.ap-south-1.compute.amazonaws.com.51944: Flags [.], ack 145, win 2179, options [nop,nop,TS val 2753543062 ecr 254248477], length 0
13:03:54.160635 IP ec2-13-233-98-105.ap-south-1.compute.amazonaws.com.31682 > ip-192-168-72-36.ap-south-1.compute.internal.http-alt: Flags [P.], seq 16384:20480, ack 1, win 6283, options [nop,nop,TS val 4073909683 ecr 4199669080], length 4096: HTTP
13:03:54.160662 IP ip-192-168-72-36.ap-south-1.compute.internal.http-alt > ec2-13-233-98-105.ap-south-1.compute.amazonaws.com.31682: Flags [.], ack 20480, win 442, options [nop,nop,TS val 4199669328 ecr 4073909683], length 0
13:03:54.160669 IP ec2-13-233-98-105.ap-south-1.compute.amazonaws.com.31682 > ip-192-168-72-36.ap-south-1.compute.internal.http-alt: Flags [P.], seq 20480:24576, ack 1, win 6283, options [nop,nop,TS val 4073909683 ecr 4199669080], length 4096: HTTP
13:03:54.160683 IP ec2-13-233-98-105.ap-south-1.compute.amazonaws.com.31682 > ip-192-168-72-36.ap-south-1.compute.internal.http-alt: Flags [P.], seq 24576:28672, ack 1, win 6283, options [nop,nop,TS val 4073909683 ecr 4199669080], length 4096: HTTP
13:03:54.160687 IP ec2-13-233-98-105.ap-south-1.compute.amazonaws.com.31682 > ip-192-168-72-36.ap-south-1.compute.internal.http-alt: Flags [P.], seq 28672:29446, ack 1, win 6283, options [nop,nop,TS val 4073909683 ecr 4199669080], length 774: HTTP
13:03:54.160723 IP ip-192-168-72-36.ap-south-1.compute.internal.http-alt > ec2-13-233-98-105.ap-south-1.compute.amazonaws.com.31682: Flags [.], ack 29446, win 442, options [nop,nop,TS val 4199669328 ecr 4073909683], length 0
13:03:54.161855 IP ip-192-168-72-36.ap-south-1.compute.internal.60820 > ip-192-168-90-230.ap-south-1.compute.internal.nfs: Flags [P.], seq 2409324607:2409324899, ack 3823107613, win 24557, options [nop,nop,TS val 2646724092 ecr 38752640], length 292: NFS request xid 466684814 288 getattr fh 0,1/53
13:03:54.162702 IP ip-192-168-90-230.ap-south-1.compute.internal.nfs > ip-192-168-72-36.ap-south-1.compute.internal.60820: Flags [P.], seq 1:245, ack 292, win 51058, options [nop,nop,TS val 38752776 ecr 2646724092], length 244: NFS reply xid 466684814 reply ok 240 getattr NON 3 ids 0/-1467719701 sz 1095933803
13:03:54.162718 IP ip-192-168-72-36.ap-south-1.compute.internal.60820 > ip-192-168-90-230.ap-south-1.compute.internal.nfs: Flags [.], ack 245, win 24557, options [nop,nop,TS val 2646724093 ecr 38752776], length 0
13:03:54.162968 IP ip-192-168-72-36.ap-south-1.compute.internal.http-alt > ec2-13-233-98-105.ap-south-1.compute.amazonaws.com.31682: Flags [P.], seq 1:360, ack 29446, win 442, options [nop,nop,TS val 4199669330 ecr 4073909683], length 359: HTTP
13:03:54.163623 IP ec2-13-233-98-105.ap-south-1.compute.amazonaws.com.31682 > ip-192-168-72-36.ap-south-1.compute.internal.http-alt: Flags [.], ack 360, win 6283, options [nop,nop,TS val 4073909686 ecr 4199669330], length 0
13:03:54.165716 IP ip-192-168-72-36.ap-south-1.compute.internal.http-alt > ec2-13-233-98-105.ap-south-1.compute.amazonaws.com.31682: Flags [P.], seq 360:398, ack 29446, win 442, options [nop,nop,TS val 4199669333 ecr 4073909686], length 38: HTTP
13:03:54.166196 IP ec2-13-233-98-105.ap-south-1.compute.amazonaws.com.31682 > ip-192-168-72-36.ap-south-1.compute.internal.http-alt: Flags [.], ack 398, win 6283, options [nop,nop,TS val 4073909689 ecr 4199669333], length 0
13:03:54.166204 IP ip-192-168-72-36.ap-south-1.compute.internal.http-alt > ec2-13-233-98-105.ap-south-1.compute.amazonaws.com.31682: Flags [P.], seq 398:436, ack 29446, win 442, options [nop,nop,TS val 4199669334 ecr 4073909689], length 38: HTTP
13:03:54.166717 IP ec2-13-233-98-105.ap-south-1.compute.amazonaws.com.31682 > ip-192-168-72-36.ap-south-1.compute.internal.http-alt: Flags [.], ack 436, win 6283, options [nop,nop,TS val 4073909689 ecr 4199669334], length 0
13:03:54.203492 IP ec2-52-66-221-224.ap-south-1.compute.amazonaws.com.51944 > ip-192-168-72-36.ap-south-1.compute.internal.http-alt: Flags [P.], seq 145:949, ack 243, win 6703, options [nop,nop,TS val 254248564 ecr 2753543062], length 804: HTTP
13:03:54.203516 IP ip-192-168-72-36.ap-south-1.compute.internal.http-alt > ec2-52-66-221-224.ap-south-1.compute.amazonaws.com.51944: Flags [.], ack 949, win 2173, options [nop,nop,TS val 2753543105 ecr 254248564], length 0
13:03:54.204747 IP ip-192-168-72-36.ap-south-1.compute.internal.http-alt > ec2-52-66-221-224.ap-south-1.compute.amazonaws.com.51944: Flags [P.], seq 243:317, ack 949, win 2179, options [nop,nop,TS val 2753543106 ecr 254248564], length 74: HTTP
13:03:54.205025 IP ec2-52-66-221-224.ap-south-1.compute.amazonaws.com.51944 > ip-192-168-72-36.ap-south-1.compute.internal.http-alt: Flags [.], ack 317, win 6703, options [nop,nop,TS val 254248565 ecr 2753543106], length 0
13:03:54.213385 IP ip-192-168-72-36.ap-south-1.compute.internal.http-alt > ec2-13-233-98-105.ap-south-1.compute.amazonaws.com.31682: Flags [P.], seq 436:835, ack 29446, win 442, options [nop,nop,TS val 4199669381 ecr 4073909689], length 399: HTTP
13:03:54.213874 IP ec2-13-233-98-105.ap-south-1.compute.amazonaws.com.31682 > ip-192-168-72-36.ap-south-1.compute.internal.http-alt: Flags [.], ack 835, win 6283, options [nop,nop,TS val 4073909736 ecr 4199669381], length 0
13:03:54.358551 IP ec2-13-233-98-105.ap-south-1.compute.amazonaws.com.31682 > ip-192-168-72-36.ap-south-1.compute.internal.http-alt: Flags [P.], seq 29446:29680, ack 835, win 6283, options [nop,nop,TS val 4073909881 ecr 4199669381], length 234: HTTP
13:03:54.359030 IP ip-192-168-72-36.ap-south-1.compute.internal.http-alt > ec2-13-233-98-105.ap-south-1.compute.amazonaws.com.31682: Flags [P.], seq 835:944, ack 29680, win 442, options [nop,nop,TS val 4199669526 ecr 4073909881], length 109: HTTP
13:03:54.359521 IP ec2-13-233-98-105.ap-south-1.compute.amazonaws.com.31682 > ip-192-168-72-36.ap-south-1.compute.internal.http-alt: Flags [.], ack 944, win 6283, options [nop,nop,TS val 4073909882 ecr 4199669526], length 0
13:03:54.363606 IP ip-192-168-72-36.ap-south-1.compute.internal.http-alt > ec2-13-233-238-212.ap-south-1.compute.amazonaws.com.11210: Flags [P.], seq 965627429:965627648, ack 2918434712, win 442, options [nop,nop,TS val 2718277262 ecr 125605077], length 219: HTTP
13:03:54.363652 IP ip-192-168-72-36.ap-south-1.compute.internal.http-alt > ec2-13-233-98-105.ap-south-1.compute.amazonaws.com.31682: Flags [P.], seq 944:1163, ack 29680, win 442, options [nop,nop,TS val 4199669531 ecr 4073909882], length 219: HTTP
13:03:54.363730 IP ec2-13-233-238-212.ap-south-1.compute.amazonaws.com.11210 > ip-192-168-72-36.ap-south-1.compute.internal.http-alt: Flags [.], ack 219, win 12305, options [nop,nop,TS val 125609457 ecr 2718277262], length 0
13:03:54.364147 IP ec2-13-233-98-105.ap-south-1.compute.amazonaws.com.31682 > ip-192-168-72-36.ap-south-1.compute.internal.http-alt: Flags [.], ack 1163, win 6283, options [nop,nop,TS val 4073909887 ecr 4199669531], length 0
13:03:54.365773 IP ec2-13-233-98-105.ap-south-1.compute.amazonaws.com.31682 > ip-192-168-72-36.ap-south-1.compute.internal.http-alt: Flags [P.], seq 29680:29916, ack 1163, win 6283, options [nop,nop,TS val 4073909888 ecr 4199669531], length 236: HTTP
13:03:54.366181 IP ip-192-168-72-36.ap-south-1.compute.internal.http-alt > ec2-13-233-98-105.ap-south-1.compute.amazonaws.com.31682: Flags [P.], seq 1163:1272, ack 29916, win 442, options [nop,nop,TS val 4199669534 ecr 4073909888], length 109: HTTP
13:03:54.379671 IP ec2-52-66-221-224.ap-south-1.compute.amazonaws.com.51944 > ip-192-168-72-36.ap-south-1.compute.internal.http-alt: Flags [P.], seq 949:2540, ack 317, win 6703, options [nop,nop,TS val 254248740 ecr 2753543106], length 1591: HTTP
13:03:54.379743 IP ip-192-168-72-36.ap-south-1.compute.internal.http-alt > ec2-52-66-221-224.ap-south-1.compute.amazonaws.com.51944: Flags [.], ack 2540, win 2179, options [nop,nop,TS val 2753543281 ecr 254248740], length 0
13:03:54.380361 IP ip-192-168-72-36.ap-south-1.compute.internal.http-alt > ec2-52-66-221-224.ap-south-1.compute.amazonaws.com.51944: Flags [P.], seq 317:427, ack 2540, win 2179, options [nop,nop,TS val 2753543282 ecr 254248740], length 110: HTTP
13:03:54.380628 IP ec2-52-66-221-224.ap-south-1.compute.amazonaws.com.51944 > ip-192-168-72-36.ap-south-1.compute.internal.http-alt: Flags [.], ack 427, win 6703, options [nop,nop,TS val 254248741 ecr 2753543282], length 0
13:03:54.407455 IP ec2-13-233-98-105.ap-south-1.compute.amazonaws.com.31682 > ip-192-168-72-36.ap-south-1.compute.internal.http-alt: Flags [.], ack 1272, win 6283, options [nop,nop,TS val 4073909930 ecr 4199669534], length 0
13:03:54.466176 IP ec2-52-66-221-224.ap-south-1.compute.amazonaws.com.51944 > ip-192-168-72-36.ap-south-1.compute.internal.http-alt: Flags [P.], seq 2540:3449, ack 427, win 6703, options [nop,nop,TS val 254248827 ecr 2753543282], length 909: HTTP
13:03:54.466672 IP ip-192-168-72-36.ap-south-1.compute.internal.http-alt > ec2-52-66-221-224.ap-south-1.compute.amazonaws.com.51944: Flags [P.], seq 427:537, ack 3449, win 2179, options [nop,nop,TS val 2753543368 ecr 254248827], length 110: HTTP
13:03:54.466943 IP ec2-52-66-221-224.ap-south-1.compute.amazonaws.com.51944 > ip-192-168-72-36.ap-south-1.compute.internal.http-alt: Flags [.], ack 537, win 6703, options [nop,nop,TS val 254248827 ecr 2753543368], length 0
13:03:54.520550 IP ec2-13-233-98-105.ap-south-1.compute.amazonaws.com.31681 > ip-192-168-72-36.ap-south-1.compute.internal.http-alt: Flags [P.], seq 2860389743:2860390652, ack 1248642654, win 330, options [nop,nop,TS val 4073910043 ecr 4199665328], length 909: HTTP
13:03:54.520574 IP ip-192-168-72-36.ap-south-1.compute.internal.http-alt > ec2-13-233-98-105.ap-south-1.compute.amazonaws.com.31681: Flags [.], ack 909, win 442, options [nop,nop,TS val 4199669688 ecr 4073910043], length 0
13:03:54.521140 IP ip-192-168-72-36.ap-south-1.compute.internal.http-alt > ec2-13-233-98-105.ap-south-1.compute.amazonaws.com.31681: Flags [P.], seq 1:111, ack 909, win 442, options [nop,nop,TS val 4199669689 ecr 4073910043], length 110: HTTP
13:03:54.521780 IP ec2-13-233-98-105.ap-south-1.compute.amazonaws.com.31681 > ip-192-168-72-36.ap-south-1.compute.internal.http-alt: Flags [.], ack 111, win 330, options [nop,nop,TS val 4073910044 ecr 4199669689], length 0
13:03:54.530773 IP ec2-13-233-238-212.ap-south-1.compute.amazonaws.com.11210 > ip-192-168-72-36.ap-south-1.compute.internal.http-alt: Flags [P.], seq 1:461, ack 219, win 12305, options [nop,nop,TS val 125609624 ecr 2718277262], length 460: HTTP
13:03:54.530797 IP ip-192-168-72-36.ap-south-1.compute.internal.http-alt > ec2-13-233-238-212.ap-south-1.compute.amazonaws.com.11210: Flags [.], ack 461, win 442, options [nop,nop,TS val 2718277429 ecr 125609624], length 0
13:03:54.532958 IP ip-192-168-72-36.ap-south-1.compute.internal.http-alt > ec2-13-233-238-212.ap-south-1.compute.amazonaws.com.11210: Flags [P.], seq 219:326, ack 461, win 442, options [nop,nop,TS val 2718277431 ecr 125609624], length 107: HTTP
13:03:54.533161 IP ec2-13-233-238-212.ap-south-1.compute.amazonaws.com.11210 > ip-192-168-72-36.ap-south-1.compute.internal.http-alt: Flags [.], ack 326, win 12305, options [nop,nop,TS val 125609626 ecr 2718277431], length 0
13:03:54.533254 IP ip-192-168-72-36.ap-south-1.compute.internal.http-alt > ec2-13-233-238-212.ap-south-1.compute.amazonaws.com.11210: Flags [.], seq 326:1774, ack 461, win 442, options [nop,nop,TS val 2718277432 ecr 125609626], length 1448: HTTP
13:03:54.533257 IP ip-192-168-72-36.ap-south-1.compute.internal.http-alt > ec2-13-233-238-212.ap-south-1.compute.amazonaws.com.11210: Flags [.], seq 1774:3222, ack 461, win 442, options [nop,nop,TS val 2718277432 ecr 125609626], length 1448: HTTP
13:03:54.533258 IP ip-192-168-72-36.ap-south-1.compute.internal.http-alt > ec2-13-233-238-212.ap-south-1.compute.amazonaws.com.11210: Flags [.], seq 3222:4670, ack 461, win 442, options [nop,nop,TS val 2718277432 ecr 125609626], length 1448: HTTP
13:03:54.533259 IP ip-192-168-72-36.ap-south-1.compute.internal.http-alt > ec2-13-233-238-212.ap-south-1.compute.amazonaws.com.11210: Flags [.], seq 4670:6118, ack 461, win 442, options [nop,nop,TS val 2718277432 ecr 125609626], length 1448: HTTP
13:03:54.533260 IP ip-192-168-72-36.ap-south-1.compute.internal.http-alt > ec2-13-233-238-212.ap-south-1.compute.amazonaws.com.11210: Flags [.], seq 6118:7566, ack 461, win 442, options [nop,nop,TS val 2718277432 ecr 125609626], length 1448: HTTP
13:03:54.533267 IP ip-192-168-72-36.ap-south-1.compute.internal.http-alt > ec2-13-233-238-212.ap-south-1.compute.amazonaws.com.11210: Flags [.], seq 7566:9014, ack 461, win 442, options [nop,nop,TS val 2718277432 ecr 125609626], length 1448: HTTP
13:03:54.533268 IP ip-192-168-72-36.ap-south-1.compute.internal.http-alt > ec2-13-233-238-212.ap-south-1.compute.amazonaws.com.11210: Flags [.], seq 9014:10462, ack 461, win 442, options [nop,nop,TS val 2718277432 ecr 125609626], length 1448: HTTP
13:03:54.533270 IP ip-192-168-72-36.ap-south-1.compute.internal.http-alt > ec2-13-233-238-212.ap-south-1.compute.amazonaws.com.11210: Flags [.], seq 10462:11910, ack 461, win 442, options [nop,nop,TS val 2718277432 ecr 125609626], length 1448: HTTP
13:03:54.533271 IP ip-192-168-72-36.ap-south-1.compute.internal.http-alt > ec2-13-233-238-212.ap-south-1.compute.amazonaws.com.11210: Flags [.], seq 11910:13358, ack 461, win 442, options [nop,nop,TS val 2718277432 ecr 125609626], length 1448: HTTP
13:03:54.533272 IP ip-192-168-72-36.ap-south-1.compute.internal.http-alt > ec2-13-233-238-212.ap-south-1.compute.amazonaws.com.11210: Flags [.], seq 13358:14806, ack 461, win 442, options [nop,nop,TS val 2718277432 ecr 125609626], length 1448: HTTP
13:03:54.533791 IP ec2-13-233-238-212.ap-south-1.compute.amazonaws.com.11210 > ip-192-168-72-36.ap-south-1.compute.internal.http-alt: Flags [.], ack 3222, win 12305, options [nop,nop,TS val 125609627 ecr 2718277432], length 0
13:03:54.533803 IP ip-192-168-72-36.ap-south-1.compute.internal.http-alt > ec2-13-233-238-212.ap-south-1.compute.amazonaws.com.11210: Flags [.], seq 14806:16254, ack 461, win 442, options [nop,nop,TS val 2718277432 ecr 125609627], length 1448: HTTP
13:03:54.533805 IP ip-192-168-72-36.ap-south-1.compute.internal.http-alt > ec2-13-233-238-212.ap-south-1.compute.amazonaws.com.11210: Flags [.], seq 16254:17702, ack 461, win 442, options [nop,nop,TS val 2718277432 ecr 125609627], length 1448: HTTP
13:03:54.533806 IP ip-192-168-72-36.ap-south-1.compute.internal.http-alt > ec2-13-233-238-212.ap-south-1.compute.amazonaws.com.11210: Flags [.], seq 17702:19150, ack 461, win 442, options [nop,nop,TS val 2718277432 ecr 125609627], length 1448: HTTP
13:03:54.533807 IP ip-192-168-72-36.ap-south-1.compute.internal.http-alt > ec2-13-233-238-212.ap-south-1.compute.amazonaws.com.11210: Flags [.], seq 19150:20598, ack 461, win 442, options [nop,nop,TS val 2718277432 ecr 125609627], length 1448: HTTP
13:03:54.533811 IP ec2-13-233-238-212.ap-south-1.compute.amazonaws.com.11210 > ip-192-168-72-36.ap-south-1.compute.internal.http-alt: Flags [.], ack 9014, win 12305, options [nop,nop,TS val 125609627 ecr 2718277432], length 0
13:03:54.533817 IP ip-192-168-72-36.ap-south-1.compute.internal.http-alt > ec2-13-233-238-212.ap-south-1.compute.amazonaws.com.11210: Flags [.], seq 20598:22046, ack 461, win 442, options [nop,nop,TS val 2718277432 ecr 125609627], length 1448: HTTP
13:03:54.533818 IP ip-192-168-72-36.ap-south-1.compute.internal.http-alt > ec2-13-233-238-212.ap-south-1.compute.amazonaws.com.11210: Flags [.], seq 22046:23494, ack 461, win 442, options [nop,nop,TS val 2718277432 ecr 125609627], length 1448: HTTP
13:03:54.533819 IP ip-192-168-72-36.ap-south-1.compute.internal.http-alt > ec2-13-233-238-212.ap-south-1.compute.amazonaws.com.11210: Flags [.], seq 23494:24942, ack 461, win 442, options [nop,nop,TS val 2718277432 ecr 125609627], length 1448: HTTP
13:03:54.533820 IP ip-192-168-72-36.ap-south-1.compute.internal.http-alt > ec2-13-233-238-212.ap-south-1.compute.amazonaws.com.11210: Flags [.], seq 24942:26390, ack 461, win 442, options [nop,nop,TS val 2718277432 ecr 125609627], length 1448: HTTP
13:03:54.533822 IP ip-192-168-72-36.ap-south-1.compute.internal.http-alt > ec2-13-233-238-212.ap-south-1.compute.amazonaws.com.11210: Flags [P.], seq 26390:27390, ack 461, win 442, options [nop,nop,TS val 2718277432 ecr 125609627], length 1000: HTTP
13:03:54.533824 IP ec2-13-233-238-212.ap-south-1.compute.amazonaws.com.11210 > ip-192-168-72-36.ap-south-1.compute.internal.http-alt: Flags [.], ack 14806, win 12305, options [nop,nop,TS val 125609627 ecr 2718277432], length 0
13:03:54.533936 IP ec2-13-233-238-212.ap-south-1.compute.amazonaws.com.11210 > ip-192-168-72-36.ap-south-1.compute.internal.http-alt: Flags [.], ack 16254, win 12305, options [nop,nop,TS val 125609627 ecr 2718277432], length 0
13:03:54.533950 IP ec2-13-233-238-212.ap-south-1.compute.amazonaws.com.11210 > ip-192-168-72-36.ap-south-1.compute.internal.http-alt: Flags [.], ack 24942, win 12305, options [nop,nop,TS val 125609627 ecr 2718277432], length 0
13:03:54.533953 IP ec2-13-233-238-212.ap-south-1.compute.amazonaws.com.11210 > ip-192-168-72-36.ap-south-1.compute.internal.http-alt: Flags [.], ack 27390, win 12305, options [nop,nop,TS val 125609627 ecr 2718277432], length 0
13:03:54.846087 IP ip-192-168-72-36.ap-south-1.compute.internal.60820 > ip-192-168-90-230.ap-south-1.compute.internal.nfs: Flags [P.], seq 292:4716, ack 245, win 24557, options [nop,nop,TS val 2646724776 ecr 38752776], length 4424: NFS request xid 483462030 4420 getattr fh 0,1/53
13:03:54.846129 IP ip-192-168-72-36.ap-south-1.compute.internal.60820 > ip-192-168-90-230.ap-south-1.compute.internal.nfs: Flags [P.], seq 4716:5008, ack 245, win 24557, options [nop,nop,TS val 2646724777 ecr 38752776], length 292: NFS request xid 500239246 288 getattr fh 0,1/53
13:03:54.846748 IP ip-192-168-90-230.ap-south-1.compute.internal.nfs > ip-192-168-72-36.ap-south-1.compute.internal.60820: Flags [.], ack 5008, win 51058, options [nop,nop,TS val 38752947 ecr 2646724776], length 0
13:03:54.846949 IP ip-192-168-90-230.ap-south-1.compute.internal.nfs > ip-192-168-72-36.ap-south-1.compute.internal.60820: Flags [P.], seq 245:489, ack 5008, win 51058, options [nop,nop,TS val 38752947 ecr 2646724776], length 244: NFS reply xid 500239246 reply ok 240 getattr NON 3 ids 0/-1467719701 sz 1095933803
13:03:54.846956 IP ip-192-168-72-36.ap-south-1.compute.internal.60820 > ip-192-168-90-230.ap-south-1.compute.internal.nfs: Flags [.], ack 489, win 24557, options [nop,nop,TS val 2646724777 ecr 38752947], length 0
13:03:54.847425 IP ip-192-168-72-36.ap-south-1.compute.internal.60820 > ip-192-168-90-230.ap-south-1.compute.internal.nfs: Flags [P.], seq 5008:13528, ack 489, win 24557, options [nop,nop,TS val 2646724778 ecr 38752947], length 8520: NFS request xid 517016462 8516 getattr fh 0,1/53
13:03:54.850801 IP ip-192-168-90-230.ap-south-1.compute.internal.nfs > ip-192-168-72-36.ap-south-1.compute.internal.60820: Flags [P.], seq 489:669, ack 13528, win 51058, options [nop,nop,TS val 38752948 ecr 2646724778], length 180: NFS reply xid 483462030 reply ok 176 getattr NON 4 ids 0/-1467719701 sz 1095933803
13:03:54.850888 IP ip-192-168-72-36.ap-south-1.compute.internal.60820 > ip-192-168-90-230.ap-south-1.compute.internal.nfs: Flags [P.], seq 13528:13820, ack 669, win 24557, options [nop,nop,TS val 2646724781 ecr 38752948], length 292: NFS request xid 533793678 288 getattr fh 0,1/53
13:03:54.850911 IP ip-192-168-72-36.ap-south-1.compute.internal.http-alt > ec2-52-66-221-224.ap-south-1.compute.amazonaws.com.51944: Flags [.], seq 537:1985, ack 3449, win 2179, options [nop,nop,TS val 2753543752 ecr 254248827], length 1448: HTTP
13:03:54.850913 IP ip-192-168-72-36.ap-south-1.compute.internal.http-alt > ec2-52-66-221-224.ap-south-1.compute.amazonaws.com.51944: Flags [.], seq 1985:3433, ack 3449, win 2179, options [nop,nop,TS val 2753543752 ecr 254248827], length 1448: HTTP
13:03:54.850913 IP ip-192-168-72-36.ap-south-1.compute.internal.http-alt > ec2-52-66-221-224.ap-south-1.compute.amazonaws.com.51944: Flags [.], seq 3433:4881, ack 3449, win 2179, options [nop,nop,TS val 2753543752 ecr 254248827], length 1448: HTTP
13:03:54.850920 IP ip-192-168-72-36.ap-south-1.compute.internal.http-alt > ec2-52-66-221-224.ap-south-1.compute.amazonaws.com.51944: Flags [.], seq 4881:6329, ack 3449, win 2179, options [nop,nop,TS val 2753543752 ecr 254248827], length 1448: HTTP
13:03:54.850921 IP ip-192-168-72-36.ap-south-1.compute.internal.http-alt > ec2-52-66-221-224.ap-south-1.compute.amazonaws.com.51944: Flags [.], seq 6329:7777, ack 3449, win 2179, options [nop,nop,TS val 2753543752 ecr 254248827], length 1448: HTTP
13:03:54.850922 IP ip-192-168-72-36.ap-south-1.compute.internal.http-alt > ec2-52-66-221-224.ap-south-1.compute.amazonaws.com.51944: Flags [.], seq 7777:9225, ack 3449, win 2179, options [nop,nop,TS val 2753543752 ecr 254248827], length 1448: HTTP
13:03:54.850945 IP ip-192-168-72-36.ap-south-1.compute.internal.http-alt > ec2-52-66-221-224.ap-south-1.compute.amazonaws.com.51944: Flags [.], seq 9225:10673, ack 3449, win 2179, options [nop,nop,TS val 2753543752 ecr 254248827], length 1448: HTTP
13:03:54.850946 IP ip-192-168-72-36.ap-south-1.compute.internal.http-alt > ec2-52-66-221-224.ap-south-1.compute.amazonaws.com.51944: Flags [.], seq 10673:12121, ack 3449, win 2179, options [nop,nop,TS val 2753543752 ecr 254248827], length 1448: HTTP
13:03:54.850946 IP ip-192-168-72-36.ap-south-1.compute.internal.http-alt > ec2-52-66-221-224.ap-south-1.compute.amazonaws.com.51944: Flags [.], seq 12121:13569, ack 3449, win 2179, options [nop,nop,TS val 2753543752 ecr 254248827], length 1448: HTTP
13:03:54.851113 IP ip-192-168-72-36.ap-south-1.compute.internal.http-alt > ec2-52-66-221-224.ap-south-1.compute.amazonaws.com.51944: Flags [.], seq 13569:15017, ack 3449, win 2179, options [nop,nop,TS val 2753543753 ecr 254248827], length 1448: HTTP
13:03:54.851276 IP ec2-52-66-221-224.ap-south-1.compute.amazonaws.com.51944 > ip-192-168-72-36.ap-south-1.compute.internal.http-alt: Flags [.], ack 9225, win 6636, options [nop,nop,TS val 254249212 ecr 2753543752], length 0
13:03:54.851285 IP ip-192-168-72-36.ap-south-1.compute.internal.http-alt > ec2-52-66-221-224.ap-south-1.compute.amazonaws.com.51944: Flags [.], seq 15017:16465, ack 3449, win 2179, options [nop,nop,TS val 2753543753 ecr 254249212], length 1448: HTTP
13:03:54.851286 IP ip-192-168-72-36.ap-south-1.compute.internal.http-alt > ec2-52-66-221-224.ap-south-1.compute.amazonaws.com.51944: Flags [.], seq 16465:17913, ack 3449, win 2179, options [nop,nop,TS val 2753543753 ecr 254249212], length 1448: HTTP
13:03:54.851287 IP ip-192-168-72-36.ap-south-1.compute.internal.http-alt > ec2-52-66-221-224.ap-south-1.compute.amazonaws.com.51944: Flags [.], seq 17913:19361, ack 3449, win 2179, options [nop,nop,TS val 2753543753 ecr 254249212], length 1448: HTTP
13:03:54.851288 IP ip-192-168-72-36.ap-south-1.compute.internal.http-alt > ec2-52-66-221-224.ap-south-1.compute.amazonaws.com.51944: Flags [.], seq 19361:20809, ack 3449, win 2179, options [nop,nop,TS val 2753543753 ecr 254249212], length 1448: HTTP
13:03:54.851288 IP ip-192-168-72-36.ap-south-1.compute.internal.http-alt > ec2-52-66-221-224.ap-south-1.compute.amazonaws.com.51944: Flags [P.], seq 20809:21319, ack 3449, win 2179, options [nop,nop,TS val 2753543753 ecr 254249212], length 510: HTTP
13:03:54.851291 IP ec2-52-66-221-224.ap-south-1.compute.amazonaws.com.51944 > ip-192-168-72-36.ap-south-1.compute.internal.http-alt: Flags [.], ack 13569, win 6671, options [nop,nop,TS val 254249212 ecr 2753543752], length 0
13:03:54.851507 IP ip-192-168-90-230.ap-south-1.compute.internal.nfs > ip-192-168-72-36.ap-south-1.compute.internal.60820: Flags [P.], seq 669:913, ack 13820, win 51058, options [nop,nop,TS val 38752948 ecr 2646724781], length 244: NFS reply xid 533793678 reply ok 240 getattr NON 3 ids 0/-1467719701 sz 1095933803
13:03:54.851515 IP ec2-52-66-221-224.ap-south-1.compute.amazonaws.com.51944 > ip-192-168-72-36.ap-south-1.compute.internal.http-alt: Flags [.], ack 15017, win 6703, options [nop,nop,TS val 254249212 ecr 2753543753], length 0
13:03:54.851543 IP ec2-52-66-221-224.ap-south-1.compute.amazonaws.com.51944 > ip-192-168-72-36.ap-south-1.compute.internal.http-alt: Flags [.], ack 19361, win 6671, options [nop,nop,TS val 254249212 ecr 2753543753], length 0
13:03:54.851588 IP ec2-52-66-221-224.ap-south-1.compute.amazonaws.com.51944 > ip-192-168-72-36.ap-south-1.compute.internal.http-alt: Flags [.], ack 21319, win 6687, options [nop,nop,TS val 254249212 ecr 2753543753], length 0
13:03:54.860578 IP ip-192-168-90-230.ap-south-1.compute.internal.nfs > ip-192-168-72-36.ap-south-1.compute.internal.60820: Flags [P.], seq 913:1093, ack 13820, win 51058, options [nop,nop,TS val 38752950 ecr 2646724781], length 180: NFS reply xid 517016462 reply ok 176 getattr NON 4 ids 0/-1467719701 sz 1095933803
13:03:54.860606 IP ip-192-168-72-36.ap-south-1.compute.internal.60820 > ip-192-168-90-230.ap-south-1.compute.internal.nfs: Flags [.], ack 1093, win 24557, options [nop,nop,TS val 2646724791 ecr 38752948], length 0
13:03:54.860675 IP ip-192-168-72-36.ap-south-1.compute.internal.60820 > ip-192-168-90-230.ap-south-1.compute.internal.nfs: Flags [P.], seq 13820:14112, ack 1093, win 24557, options [nop,nop,TS val 2646724791 ecr 38752948], length 292: NFS request xid 550570894 288 getattr fh 0,1/53
13:03:54.861108 IP ip-192-168-90-230.ap-south-1.compute.internal.nfs > ip-192-168-72-36.ap-south-1.compute.internal.60820: Flags [P.], seq 1093:1337, ack 14112, win 51058, options [nop,nop,TS val 38752951 ecr 2646724791], length 244: NFS reply xid 550570894 reply ok 240 getattr NON 3 ids 0/-1467719701 sz 1095933803
13:03:54.861967 IP ip-192-168-72-36.ap-south-1.compute.internal.60820 > ip-192-168-90-230.ap-south-1.compute.internal.nfs: Flags [P.], seq 14112:14404, ack 1337, win 24557, options [nop,nop,TS val 2646724792 ecr 38752951], length 292: NFS request xid 567348110 288 getattr fh 0,1/53
13:03:54.862603 IP ip-192-168-90-230.ap-south-1.compute.internal.nfs > ip-192-168-72-36.ap-south-1.compute.internal.60820: Flags [P.], seq 1337:1581, ack 14404, win 51058, options [nop,nop,TS val 38752951 ecr 2646724792], length 244: NFS reply xid 567348110 reply ok 240 getattr NON 3 ids 0/-1467719701 sz 1095933803
13:03:54.863550 IP ip-192-168-72-36.ap-south-1.compute.internal.60820 > ip-192-168-90-230.ap-south-1.compute.internal.nfs: Flags [P.], seq 14404:22924, ack 1581, win 24557, options [nop,nop,TS val 2646724794 ecr 38752951], length 8520: NFS request xid 584125326 8516 getattr fh 0,1/53
13:03:54.875978 IP ip-192-168-90-230.ap-south-1.compute.internal.nfs > ip-192-168-72-36.ap-south-1.compute.internal.60820: Flags [P.], seq 1581:1761, ack 22924, win 51058, options [nop,nop,TS val 38752954 ecr 2646724794], length 180: NFS reply xid 584125326 reply ok 176 getattr NON 4 ids 0/-1467719701 sz 1095933803
13:03:54.876093 IP ip-192-168-72-36.ap-south-1.compute.internal.60820 > ip-192-168-90-230.ap-south-1.compute.internal.nfs: Flags [P.], seq 22924:23216, ack 1761, win 24557, options [nop,nop,TS val 2646724806 ecr 38752954], length 292: NFS request xid 600902542 288 getattr fh 0,1/53
13:03:54.876556 IP ip-192-168-90-230.ap-south-1.compute.internal.nfs > ip-192-168-72-36.ap-south-1.compute.internal.60820: Flags [P.], seq 1761:2005, ack 23216, win 51058, options [nop,nop,TS val 38752954 ecr 2646724806], length 244: NFS reply xid 600902542 reply ok 240 getattr NON 3 ids 0/-1467719701 sz 1095933803
13:03:54.902039 IP ip-192-168-72-36.ap-south-1.compute.internal.http-alt > ec2-13-233-98-105.ap-south-1.compute.amazonaws.com.31682: Flags [P.], seq 1272:1515, ack 29916, win 442, options [nop,nop,TS val 4199670069 ecr 4073909930], length 243: HTTP
13:03:54.902546 IP ec2-13-233-98-105.ap-south-1.compute.amazonaws.com.31682 > ip-192-168-72-36.ap-south-1.compute.internal.http-alt: Flags [.], ack 1515, win 6283, options [nop,nop,TS val 4073910425 ecr 4199670069], length 0
13:03:54.920189 IP ip-192-168-72-36.ap-south-1.compute.internal.60820 > ip-192-168-90-230.ap-south-1.compute.internal.nfs: Flags [.], ack 2005, win 24557, options [nop,nop,TS val 2646724851 ecr 38752954], length 0
13:03:54.941361 IP ec2-52-66-221-224.ap-south-1.compute.amazonaws.com.51944 > ip-192-168-72-36.ap-south-1.compute.internal.http-alt: Flags [P.], seq 3449:3510, ack 21319, win 6703, options [nop,nop,TS val 254249302 ecr 2753543753], length 61: HTTP
13:03:54.941623 IP ip-192-168-72-36.ap-south-1.compute.internal.http-alt > ec2-52-66-221-224.ap-south-1.compute.amazonaws.com.51944: Flags [P.], seq 21319:21357, ack 3510, win 2179, options [nop,nop,TS val 2753543843 ecr 254249302], length 38: HTTP
13:03:54.941917 IP ec2-52-66-221-224.ap-south-1.compute.amazonaws.com.51944 > ip-192-168-72-36.ap-south-1.compute.internal.http-alt: Flags [.], ack 21357, win 6703, options [nop,nop,TS val 254249302 ecr 2753543843], length 0
13:03:55.002780 IP ec2-52-66-221-224.ap-south-1.compute.amazonaws.com.51944 > ip-192-168-72-36.ap-south-1.compute.internal.http-alt: Flags [P.], seq 3510:4314, ack 21357, win 6703, options [nop,nop,TS val 254249363 ecr 2753543843], length 804: HTTP
13:03:55.003600 IP ip-192-168-72-36.ap-south-1.compute.internal.http-alt > ec2-52-66-221-224.ap-south-1.compute.amazonaws.com.51944: Flags [P.], seq 21357:21431, ack 4314, win 2179, options [nop,nop,TS val 2753543905 ecr 254249363], length 74: HTTP
13:03:55.003901 IP ec2-52-66-221-224.ap-south-1.compute.amazonaws.com.51944 > ip-192-168-72-36.ap-south-1.compute.internal.http-alt: Flags [.], ack 21431, win 6703, options [nop,nop,TS val 254249364 ecr 2753543905], length 0
13:03:55.168651 IP ec2-13-233-98-105.ap-south-1.compute.amazonaws.com.31682 > ip-192-168-72-36.ap-south-1.compute.internal.http-alt: Flags [P.], seq 29916:30374, ack 1515, win 6283, options [nop,nop,TS val 4073910691 ecr 4199670069], length 458: HTTP
13:03:55.169868 IP ip-192-168-72-36.ap-south-1.compute.internal.60820 > ip-192-168-90-230.ap-south-1.compute.internal.nfs: Flags [P.], seq 23216:23548, ack 2005, win 24557, options [nop,nop,TS val 2646725100 ecr 38752954], length 332: NFS request xid 617679758 328 getattr fh 0,1/53
13:03:55.169987 IP ip-192-168-72-36.ap-south-1.compute.internal.http-alt > ec2-13-233-98-105.ap-south-1.compute.amazonaws.com.31682: Flags [P.], seq 1515:1611, ack 30374, win 442, options [nop,nop,TS val 4199670337 ecr 4073910691], length 96: HTTP
13:03:55.170777 IP ec2-13-233-98-105.ap-south-1.compute.amazonaws.com.31682 > ip-192-168-72-36.ap-south-1.compute.internal.http-alt: Flags [.], ack 1611, win 6283, options [nop,nop,TS val 4073910693 ecr 4199670337], length 0
13:03:55.171335 IP ip-192-168-90-230.ap-south-1.compute.internal.nfs > ip-192-168-72-36.ap-south-1.compute.internal.60820: Flags [P.], seq 2005:2105, ack 23548, win 51058, options [nop,nop,TS val 38753028 ecr 2646725100], length 100: NFS reply xid 617679758 reply ok 96 getattr ERROR: No such file or directory
13:03:55.171340 IP ip-192-168-72-36.ap-south-1.compute.internal.60820 > ip-192-168-90-230.ap-south-1.compute.internal.nfs: Flags [.], ack 2105, win 24557, options [nop,nop,TS val 2646725102 ecr 38753028], length 0
13:03:55.171736 IP ip-192-168-72-36.ap-south-1.compute.internal.http-alt > ec2-13-233-98-105.ap-south-1.compute.amazonaws.com.31682: Flags [P.], seq 1611:2460, ack 30374, win 442, options [nop,nop,TS val 4199670339 ecr 4073910693], length 849: HTTP
13:03:55.172219 IP ec2-13-233-98-105.ap-south-1.compute.amazonaws.com.31682 > ip-192-168-72-36.ap-south-1.compute.internal.http-alt: Flags [.], ack 2460, win 6283, options [nop,nop,TS val 4073910695 ecr 4199670339], length 0
13:03:55.251013 IP ec2-52-66-221-224.ap-south-1.compute.amazonaws.com.51944 > ip-192-168-72-36.ap-south-1.compute.internal.http-alt: Flags [P.], seq 4314:4356, ack 21431, win 6703, options [nop,nop,TS val 254249611 ecr 2753543905], length 42: HTTP
13:03:55.276703 IP ec2-13-233-98-105.ap-south-1.compute.amazonaws.com.31682 > ip-192-168-72-36.ap-south-1.compute.internal.http-alt: Flags [P.], seq 30374:30666, ack 2460, win 6283, options [nop,nop,TS val 4073910799 ecr 4199670339], length 292: HTTP
13:03:55.277185 IP ip-192-168-72-36.ap-south-1.compute.internal.60820 > ip-192-168-90-230.ap-south-1.compute.internal.nfs: Flags [P.], seq 23548:23840, ack 2105, win 24557, options [nop,nop,TS val 2646725208 ecr 38753028], length 292: NFS request xid 634456974 288 getattr fh 0,1/53
13:03:55.278771 IP ip-192-168-90-230.ap-south-1.compute.internal.nfs > ip-192-168-72-36.ap-south-1.compute.internal.60820: Flags [P.], seq 2105:2349, ack 23840, win 51058, options [nop,nop,TS val 38753055 ecr 2646725208], length 244: NFS reply xid 634456974 reply ok 240 getattr NON 3 ids 0/-1467719701 sz 1095933803
13:03:55.278786 IP ip-192-168-72-36.ap-south-1.compute.internal.60820 > ip-192-168-90-230.ap-south-1.compute.internal.nfs: Flags [.], ack 2349, win 24557, options [nop,nop,TS val 2646725209 ecr 38753055], length 0
13:03:55.279085 IP ip-192-168-72-36.ap-south-1.compute.internal.http-alt > ec2-13-233-98-105.ap-south-1.compute.amazonaws.com.31682: Flags [P.], seq 2460:2819, ack 30666, win 442, options [nop,nop,TS val 4199670446 ecr 4073910799], length 359: HTTP
13:03:55.279556 IP ec2-13-233-98-105.ap-south-1.compute.amazonaws.com.31682 > ip-192-168-72-36.ap-south-1.compute.internal.http-alt: Flags [.], ack 2819, win 6283, options [nop,nop,TS val 4073910802 ecr 4199670446], length 0
13:03:55.292182 IP ip-192-168-72-36.ap-south-1.compute.internal.http-alt > ec2-52-66-221-224.ap-south-1.compute.amazonaws.com.51944: Flags [.], ack 4356, win 2179, options [nop,nop,TS val 2753544194 ecr 254249611], length 0
13:03:55.868900 IP ip-192-168-72-36.ap-south-1.compute.internal.60820 > ip-192-168-90-230.ap-south-1.compute.internal.nfs: Flags [.], seq 23840:32588, ack 2349, win 24557, options [nop,nop,TS val 2646725799 ecr 38753055], length 8748: NFS request xid 651234190 8744 getattr fh 0,1/53
13:03:55.868947 IP ip-192-168-72-36.ap-south-1.compute.internal.60820 > ip-192-168-90-230.ap-south-1.compute.internal.nfs: Flags [P.], seq 32588:40844, ack 2349, win 24557, options [nop,nop,TS val 2646725799 ecr 38753055], length 8256
13:03:55.869310 IP ip-192-168-90-230.ap-south-1.compute.internal.nfs > ip-192-168-72-36.ap-south-1.compute.internal.60820: Flags [.], ack 40844, win 51058, options [nop,nop,TS val 38753203 ecr 2646725799], length 0
13:03:55.869980 IP ip-192-168-90-230.ap-south-1.compute.internal.nfs > ip-192-168-72-36.ap-south-1.compute.internal.60820: Flags [P.], seq 2349:2593, ack 40844, win 51058, options [nop,nop,TS val 38753203 ecr 2646725799], length 244: NFS reply xid 668011406 reply ok 240
13:03:55.869988 IP ip-192-168-72-36.ap-south-1.compute.internal.60820 > ip-192-168-90-230.ap-south-1.compute.internal.nfs: Flags [.], ack 2593, win 24557, options [nop,nop,TS val 2646725800 ecr 38753203], length 0
13:03:55.874470 IP ip-192-168-72-36.ap-south-1.compute.internal.http-alt > ec2-52-66-221-224.ap-south-1.compute.amazonaws.com.51944: Flags [.], seq 21431:22879, ack 4356, win 2179, options [nop,nop,TS val 2753544776 ecr 254249611], length 1448: HTTP
13:03:55.874475 IP ip-192-168-72-36.ap-south-1.compute.internal.http-alt > ec2-52-66-221-224.ap-south-1.compute.amazonaws.com.51944: Flags [.], seq 22879:24327, ack 4356, win 2179, options [nop,nop,TS val 2753544776 ecr 254249611], length 1448: HTTP
13:03:55.874475 IP ip-192-168-72-36.ap-south-1.compute.internal.http-alt > ec2-52-66-221-224.ap-south-1.compute.amazonaws.com.51944: Flags [.], seq 24327:25775, ack 4356, win 2179, options [nop,nop,TS val 2753544776 ecr 254249611], length 1448: HTTP
13:03:55.874476 IP ip-192-168-72-36.ap-south-1.compute.internal.http-alt > ec2-52-66-221-224.ap-south-1.compute.amazonaws.com.51944: Flags [.], seq 25775:27223, ack 4356, win 2179, options [nop,nop,TS val 2753544776 ecr 254249611], length 1448: HTTP
13:03:55.874477 IP ip-192-168-72-36.ap-south-1.compute.internal.http-alt > ec2-52-66-221-224.ap-south-1.compute.amazonaws.com.51944: Flags [.], seq 27223:28671, ack 4356, win 2179, options [nop,nop,TS val 2753544776 ecr 254249611], length 1448: HTTP
13:03:55.874483 IP ip-192-168-72-36.ap-south-1.compute.internal.http-alt > ec2-52-66-221-224.ap-south-1.compute.amazonaws.com.51944: Flags [.], seq 28671:30119, ack 4356, win 2179, options [nop,nop,TS val 2753544776 ecr 254249611], length 1448: HTTP
